{
  "schema_version": "0.3.0",
  "id": "bauhaus",
  "name": "Bauhaus",
  "aliases": [
    "Bauhaus-inspired"
  ],
  "version": "0.3.0",
  "reviewed_at": "2026-07-19",
  "source_ids": [
    "B-A1",
    "B-A2",
    "B-A3",
    "B-A4",
    "B-A5",
    "B-A6",
    "B-A7",
    "B-A8",
    "B-A9",
    "B-A10",
    "B-A11",
    "B-A12",
    "B-A13",
    "B-A14",
    "B-A15",
    "B-A16",
    "B-A17",
    "B-A18",
    "B-A19",
    "B-B1",
    "B-B2",
    "B-B3",
    "B-B4",
    "B-B5",
    "B-B6",
    "B-C1",
    "B-C2",
    "B-C3",
    "B-C4",
    "B-C5"
  ],
  "visual_ids": [
    "B-V1",
    "B-V2",
    "B-V3",
    "B-V4",
    "B-V5",
    "B-V6",
    "B-V7",
    "B-V8",
    "B-V9",
    "B-V10",
    "B-V11",
    "B-V12"
  ]
}
