{
  "schema_version": "0.3.0",
  "id": "mid-century-modern",
  "name": "Mid-century Modern",
  "aliases": [
    "MCM",
    "midcentury modern",
    "mid-century"
  ],
  "version": "0.3.0",
  "reviewed_at": "2026-07-19",
  "source_ids": [
    "M-A1",
    "M-A2",
    "M-A3",
    "M-A4",
    "M-A5",
    "M-A6",
    "M-A7",
    "M-A8",
    "M-A9",
    "M-A10",
    "M-A11",
    "M-A12",
    "M-A13",
    "M-A14",
    "M-A15",
    "M-A16",
    "M-A17",
    "M-A18",
    "M-A19",
    "M-B1",
    "M-B2",
    "M-B3",
    "M-B4",
    "M-B5",
    "M-B6",
    "M-C1",
    "M-C2",
    "M-C3",
    "M-C4",
    "M-C5"
  ],
  "visual_ids": [
    "M-V1",
    "M-V2",
    "M-V3",
    "M-V4",
    "M-V5",
    "M-V6",
    "M-V7",
    "M-V8",
    "M-V9",
    "M-V10",
    "M-V11",
    "M-V12"
  ]
}
