{
  "schema_version": "0.3.0",
  "id": "japandi",
  "name": "Japandi",
  "aliases": [
    "Japan–Nordic hybrid",
    "Japanese Scandinavian hybrid"
  ],
  "version": "0.3.0",
  "reviewed_at": "2026-07-19",
  "source_ids": [
    "J-A1",
    "J-A2",
    "J-A3",
    "J-A4",
    "J-A5",
    "J-A6",
    "J-A7",
    "J-A8",
    "J-A9",
    "J-A10",
    "J-A11",
    "J-A12",
    "J-A13",
    "J-A14",
    "J-A15",
    "J-A16",
    "J-A17",
    "J-A18",
    "J-A19",
    "J-B1",
    "J-B2",
    "J-B3",
    "J-B4",
    "J-B5",
    "J-B6",
    "J-B7",
    "J-C1",
    "J-C2",
    "J-C3",
    "J-C4",
    "J-C5",
    "J-C6",
    "J-C7"
  ],
  "visual_ids": [
    "J-S1",
    "J-S2",
    "J-S3",
    "J-S4",
    "J-S5",
    "J-S6",
    "J-S7",
    "J-S8",
    "J-S9",
    "J-V1",
    "J-V7",
    "J-V11"
  ]
}
